{
  "$schema": "../../schemas/brand-asset.schema.json",
  "$meta": {
    "name": "logo",
    "displayName": "CareSmartz360 Logo",
    "category": "brand",
    "version": "1.1.0",
    "figmaSource": {
      "fileKey": "4bh29laapcuKBTghfaRXF0",
      "sectionId": "27645:45788"
    },
    "lastAudit": "2026-09-21",
    "status": "active",
    "verification": {
      "verifiedLive_2026_09_15": "Section 27645:45788 'Logo' + all 3 variant nodes existence-verified via desktop MCP get_metadata: logo-full-compact 13848:180579 (504x160 — matches the 3.15:1 claim), logo-full 27657:3457 (1024x1024 frame), logo-monogram 27657:3458 (1024x1024 frame)",
      "unverified": [
        "brandColors hex values — Figma-AI-provided artwork fills; live color read failed (Figma MCP dropped mid-call); re-verify before any recolor work",
        "aspectRatios for logo-full/monogram — artwork ratio inside a square 1024 export frame, not the frame ratio"
      ],
      "assetsStatus": "DELIVERED 2026-09-16 — 3 SVG + 3 PNG@2x fetched via the Figma Images API inside CI (workflow figma-assets.yml, run 35087984205), format-checked (SVG XML + PNG magic) and merged in PR #36; sizes matched Figma-AI's claims. logo-wordmark assets remain pending (no Figma node yet).",
      "brandBlueCaution": "The WORDMARK blue #1C83C6 is the logo ARTWORK color. It is NOT the UI Brandblue token (#0077FF, locked by ruling). Never 'correct' one to the other.",
      "componentKeys_verified_2026_09_21": "The 3 componentKeys (logo-full f11f28…, logo-full-compact bab188…, logo-monogram 7ec093…) were reconfirmed live by Figma-AI on 2026-09-21 (C360-44235 / C360-44907) — no longer Plugin-API-only.",
      "deliveredAssets": "DELIVERED & truthful in this file: SVG + PNG@2x for the 3 keyed variants (logo-full, logo-full-compact, logo-monogram). Verified on disk.",
      "pendingAssets": [
        "PDF (logo-full, logo-monogram): the Figma Images API exposes svg/png/jpg only — export by hand from Figma into assets/pdf/ if ever needed.",
        "@1x / @3x PNG: the figma-assets workflow fetches @2x only; extend it if other scales are needed.",
        "logo-wordmark: no Figma node exists yet — blocked until one is created.",
        "brandColors hex: the 2026-09-15 live colour read dropped mid-call; re-verify from Figma before any recolor work."
      ]
    }
  },
  "variants": {
    "logo-full": {
      "description": "Complete logo: monogram icon + CareSmartz360 wordmark + tagline",
      "figmaNodeId": "27657:3457",
      "componentKey": "f11f28f66596967a55a16867ccbb32a917cb86ef",
      "usage": [
        "hero-sections",
        "login-screens",
        "print-headers",
        "splash-screens"
      ],
      "minWidth": "200px",
      "aspectRatio": "4.83:1",
      "assets": {
        "svg": "assets/svg/logo-full.svg",
        "png": [
          "assets/png/logo-full@2x.png"
        ]
      }
    },
    "logo-full-compact": {
      "description": "Compact full logo for navigation bars and headers",
      "figmaNodeId": "13848:180579",
      "componentKey": "bab188e13113e60c8f7709931bd0742b79193e5c",
      "usage": [
        "navigation-bar",
        "sidebar-header",
        "email-signature"
      ],
      "minWidth": "120px",
      "aspectRatio": "3.15:1",
      "assets": {
        "svg": "assets/svg/logo-full-compact.svg",
        "png": [
          "assets/png/logo-full-compact@2x.png"
        ]
      }
    },
    "logo-monogram": {
      "description": "Standalone monogram — three stylized human figures representing care, connection, and wellness",
      "figmaNodeId": "27657:3458",
      "componentKey": "7ec093c716bac1b7708393845f2893fb9f7e1ad7",
      "usage": [
        "favicon",
        "app-icon",
        "avatar-fallback",
        "watermark",
        "loading-spinner"
      ],
      "minWidth": "24px",
      "aspectRatio": "1.09:1",
      "assets": {
        "svg": "assets/svg/logo-monogram.svg",
        "png": [
          "assets/png/logo-monogram@2x.png"
        ]
      }
    },
    "logo-wordmark": {
      "description": "Text-only wordmark: CareSmartz360 without monogram icon",
      "figmaNodeId": null,
      "componentKey": null,
      "usage": [
        "breadcrumb",
        "footer-copyright",
        "compact-nav"
      ],
      "minWidth": "100px",
      "assets": null,
      "pending": "No Figma node yet — create the wordmark node in Figma, then the figma-assets workflow can fetch it."
    }
  },
  "brandColors": {
    "monogram": {
      "pink": {
        "hex": "#F386A1",
        "role": "Figure 1 — person (pink)"
      },
      "magenta": {
        "hex": "#E33D8A",
        "role": "Figure 1 — accent overlap"
      },
      "green": {
        "hex": "#83C994",
        "role": "Figure 2 — person (green)"
      },
      "skyBlue": {
        "hex": "#4FC6E0",
        "role": "Figure 3 — person (blue)"
      },
      "teal": {
        "hex": "#00A4C4",
        "role": "Overlap accent"
      }
    },
    "wordmark": {
      "brandBlue": {
        "hex": "#1C83C6",
        "role": "CareSmartz text color"
      },
      "darkGray": {
        "hex": "#232323",
        "role": "360 numeral + tagline"
      },
      "mediumGray": {
        "hex": "#808285",
        "role": "Tagline secondary"
      }
    }
  },
  "guidelines": {
    "clearSpace": {
      "rule": "Minimum clear space equals the height of one monogram figure on all sides",
      "marker": [
        "DERIVED"
      ]
    },
    "minimumSize": {
      "print": {
        "monogram": "12mm",
        "fullLogo": "25mm wide"
      },
      "digital": {
        "monogram": "24px",
        "fullLogo": "120px wide"
      }
    },
    "backgrounds": {
      "approved": [
        "white",
        "light-gray (#F5F5F5 or lighter)",
        "brand-blue (#1C83C6)"
      ],
      "requiresReversed": [
        "dark backgrounds (< 40% luminance)"
      ],
      "prohibited": [
        "busy photographs without overlay",
        "patterned backgrounds",
        "low-contrast same-hue backgrounds"
      ]
    },
    "modifications": {
      "prohibited": [
        "Do not rotate the logo",
        "Do not change individual colors of the monogram figures",
        "Do not separate monogram from wordmark in the full logo variant",
        "Do not add effects (shadows, gradients, outlines) to the logo",
        "Do not stretch or skew — always scale proportionally",
        "Do not rearrange the figure positions in the monogram",
        "Do not use the logo at less than minimum size"
      ]
    },
    "colorVariants": {
      "fullColor": "Default — use on white/light backgrounds",
      "reversed": "White monogram + white text — use on dark/brand-color backgrounds",
      "monochrome": "All black or all white — for single-color print, embossing, watermarks"
    }
  },
  "construction": {
    "monogram": "3 overlapping stylized human figures in pink (#F386A1), green (#83C994), and sky blue (#4FC6E0) with magenta (#E33D8A) and teal (#00A4C4) at overlap intersections. All paths are vector.",
    "wordmark": "'CareSmartz' in brand blue (#1C83C6) + '360' in dark gray (#232323). Tagline 'A BETTER WAY TO CARE' in medium gray (#808285) below.",
    "ring": "White rectangle background behind compact variant (504x160px) for clearspace protection."
  }
}
